"article_id","comment_id","parent_comment_id","comment_type","content","author","like_count","dislike_count","reply_count","created_at","scraped_at"
"65","4534","","","요즘 노인들이 다 빈곤한 거 아니다. 약간 여유있는 노인들도 많다. 어느 분야나 주고객층이 될 수 있다는 얘기다. 마케팅에서 참고해야 한다. 헌데 나이많은 사람들이 근력을 키우기 위해 헬스장에 가는데 아예 출입금지라?? 그렇다면 더러워서 그런 곳에 돈쓰지 않는다. 이따위로 영업하다 후회할 날은 반드시 온다.","gsy1****","8","0","","2024.10.29. 06:25","2025-06-10 02:59:19"
"65","4535","","","지들은 안 늙을거 같지??","avan****","4","0","","2024.10.29. 06:22","2025-06-10 02:59:19"
"65","4536","","","노인 좋아하는 곳 별로 없다. 노인복지회관에 가면 노인들 사이에서도 나이 많은 노인은 싫어하고 심지어 무시 경멸한다. 노인 스스로 젊은이와 부딪치지 않도록 눈치있게 처신할 수밖에 없다.","ykle****","8","1","","2024.10.29. 06:21","2025-06-10 02:59:19"
"65","4537","","","적당히들 하자 우리도 늙어 .나중에 부메랑임","aktm****","5","0","","2024.10.29. 06:21","2025-06-10 02:59:19"
"65","4538","","","좋지도 않은 머리를 닫아놓고 넓지도않은 가슴을 닫아놓고 사는사람 그리고 그런나라 미래없다! 양쪽다''이기저 아닌가? 부디 역사에서 교훈을~.","6411****","1","0","","2024.10.29. 06:20","2025-06-10 02:59:19"
"65","4539","","","ㅋㅋ 60대정신나간 노인들 댓글로 하소연하네 매국노세대들 ㅋㅋㅋ.","ufow****","0","0","","2024.10.29. 06:17","2025-06-10 02:59:19"
"65","4540","","","차별금지법 통과시킬려고 이런 기사로 여론몰이 하는게 눈에 보이네!!  차별금지법 반대합니다!!!!!차별금지법은 반대로 정의로운 일에 반대하는 사람들도 비판하지 못하게 하는 무서운 법입니다.","seec****","22","1","","2024.10.29. 06:17","2025-06-10 02:59:19"
"65","4541","","","아니 몇몇이 그런다고 아예 출입을 금지시키다니; 세월 금방간다- 늙어가는것도 서러운데 가고 싶은데도 못들어가면;;; ㅠㅠ","lixu****","0","0","","2024.10.29. 06:16","2025-06-10 02:59:19"
"65","4542","","","혐오와 차별만 남은 사회. 결국 공멸이지. 글은 읽을 줄 알지만 무식하고 이기적인 인간들을 모두 죽여버려야할듯","zieg****","1","0","","2024.10.29. 06:15","2025-06-10 02:59:19"
"65","4543","","","케바케지.. 우리헬스장은 30대한놈이 워낙싸가지 없어서..","heyd****","4","0","","2024.10.29. 06:14","2025-06-10 02:59:19"
"65","4544","","","인터넷도 40대 이상부터  댓글 못 쓰게 막아라 좀..","h4gh****","5","4","","2024.10.29. 06:10","2025-06-10 02:59:19"
"65","4545","","","딸피들은 적당히를 모름. ㅈㄴ 개시끄러움","gran****","1","0","","2024.10.29. 06:09","2025-06-10 02:59:19"
"65","4546","","","70대 노인들은 기본적인 예의조차 모른다. 출입 금지 시키는게 업장 운영에 더 도움된다면 그리 하는게 맞다","ilsa****","8","1","","2024.10.29. 06:08","2025-06-10 02:59:19"
"65","4547","","","적당히 시끄러워야하는데 서로 귀먹고 못 알아들어서 ㅈㄴ 시끄러움","gran****","4","0","","2024.10.29. 06:08","2025-06-10 02:59:19"
"65","4548","","","틀딱이 신문 답네","kgn3****","0","0","","2024.10.29. 06:06","2025-06-10 02:59:19"
"65","4549","","","서로 배려하는  세상이  선진국입니다","meei****","0","0","","2024.10.29. 06:05","2025-06-10 02:59:19"
"65","4550","","","뭐 어쩌겠나. 사장이 그러겠다는데. 장사하는 사람 맘이지. 나라돈이 아닌 이상 강제할수 없는법.","ceph****","4","0","","2024.10.29. 06:04","2025-06-10 02:59:19"
"65","4551","","","새벽이라 노인들만 댓글 다넹","kkh0****","2","0","","2024.10.29. 06:04","2025-06-10 02:59:19"
"65","4552","","","이런 기사거리도 안되는 기사를 실나 계층간에  불신만 조장하는 기사","c570****","2","0","","2024.10.29. 06:03","2025-06-10 02:59:19"
"65","4553","","","70대 이상 윤두팡 지지율 40퍼 이노인들이 지금 윤두창 지지율 견인해서 나라가 이꼴난거임 이 노인들이 빨리 흙이랑 단일화를 해야 대한민국이 산다","w741****","3","8","","2024.10.29. 06:02","2025-06-10 02:59:19"
"65","4554","","","헬스장에서 젊은  사람들 운동 하는데. 70대 할머니들  오만 챙건다하며   잔소리에 사람이 운동을 하고 있는데   옆에서 쳐다보며  가지도 않고.  이러쿵저러쿵 하면. 누가 또 그 헬스장 등록해서 가고 싶겠는가?","hjsh****","2","0","","2024.10.29. 06:02","2025-06-10 02:59:19"
"65","4555","","","기자야..사실관계도 좋지만..사회학자들 만나서..해결책도제시히주고..서로 배려하는 같이사는 사회만들도록하는 내용도 있어야지..자꾸 이런식이면 사회는 좀더분열되지 않은까? 그걸 노리진 않았을테고..ㅉ","seol****","45","0","","2024.10.29. 06:01","2025-06-10 02:59:19"
"65","4556","","","지하철, 공공장소, 헬스클럽, 음식점 등에서 나이 많은게  무슨 벼슬인지 주변사람들 의식하지 않고 주책스런 언행을 하는 어르신들이 조심하셔야 한다. 그동안 고생해서 키운 자식들에게 왜 쓸데없이 소외당하고 욕을 먹어야 하나?","aqua****","9","1","","2024.10.29. 06:00","2025-06-10 02:59:19"
"65","4557","","","OK Boomer","joda****","0","0","","2024.10.29. 05:59","2025-06-10 02:59:19"
"65","4558","","","어떤 대기업 회장이 번 돈을 사회에 환원하는 차원에서 나눠준 적이 있었다. 그런 자금들이 모여서 전국에 시니어존 즉 노인들만의 헬스장 수영장 카페 식당 등 호텔급 고급시설들이 생겨나야 한다. 최고급 시설과 서비스제공으로 그동안 힘들게 살아온 인생을 보상해줘야 한다. 열심히 일해서 집사고 땅사고 자식키우고 이제 늙어서 잘살아 볼까 했는데 늙었다고 다 뺏기고 오히려 쫓겨났으니 이 얼마나 서러운가. 자식한테 쫓겨난 기분일거다. 내가 벌어놓은 내재산 내건물에서 쫓겨난 기분일거다. 그 자리에 젊은 자식과 젊은 외국인 불체자들이 가득차 있다.","kore****","1","0","","2024.10.29. 05:59","2025-06-10 02:59:19"
"65","4559","","","고령화가 젤 심각해서 나중에는 시니어 없으면 자영업 다 힘들텐데","ques****","0","0","","2024.10.29. 05:56","2025-06-10 02:59:19"
"65","4560","","","왜 모르는 분을 단순히 고령이라는 이유로 부모라고 생각해야하는지..? 제발 타인의 시공간을 존중해줬으면, 우리나라의 과도한 오지랖 문화 좀 없어졌으면(오지랖은 '정'이 아닙니다), 모두가 좀 더 개인주의적이 되어 남과 피해를 안주고 안받는 세상이 되길 바랍니다..","beas****","8","9","","2024.10.29. 05:55","2025-06-10 02:59:19"
"65","4561","","","커피한잔   시켜놓고 몇시간씩  꼴아지도  보기싫은  카페에서  업무보는 하찮은 것들이  말이 많다.","phys****","29","1","","2024.10.29. 05:54","2025-06-10 02:59:19"
"65","4562","","","할머니가 뮨제다. 왜이리 떠들고 말을거는거야. 할아버지는 조용한편이다. 늙으면 여자들이 드세다는 말이 맞다. 급악셓 할매 많고","kuru****","3","1","","2024.10.29. 05:53","2025-06-10 02:59:19"
"65","4563","","","요즘 젊은 애들 중 이상한 애 많습니다, 노인들도 공중도덕을 지켜 젊은이들한테 책잡히지 마세요.꼭 일부의 사림들이 문제를 이르킵니다,  젊은 사람들중에 일부가 어른을 몰라보고 그러는데 그런애들은 지  부모도 몰라봅니다, 나이로 출입제한하는 카페는 영업정지를 시켜야 됩니다, 그건 사회적 차별을 하는 것입니다.","ksk3****","7","1","","2024.10.29. 05:53","2025-06-10 02:59:19"
"65","4564","","","모두들 50대 이상 노인들은 출입금지 시켜야 된다고 하는데 50대는 출입시켜도 될 듯함","111g****","0","2","","2024.10.29. 05:52","2025-06-10 02:59:19"
"65","4565","","","멋지게 나이드는건 정말 힘든일이지. 쓸데없이 다른 사람한테 말걸지 말고. 혹시 자리를 함께하면 말이 아니라 돈을 쓸수 있는 경제력도 갖출수 있도록 나이들면 좋을텐데. 가능하려나","hw06****","2","0","","2024.10.29. 05:52","2025-06-10 02:59:19"
"65","4566","","","세대 갈라치기 글인가? 노인 욕하지마라, 니가 갈 길이다. 누구나 늙는다. 어느 곳이든 미꾸라지 한마리가 물 흐릴뿐... 그 한마리로 전체를 싸잡아 욕하지말자","6014****","40","2","","2024.10.29. 05:49","2025-06-10 02:59:19"
"65","4567","","","저게 단순히 말 거는 게 아니라 운동자세 지적질, 훈수, 참견질때문에 그래요. 초면에 예의 없는 못배워 먹은 사람이면 나이가 몇이든 상종하고 싶지 않음.","stel****","52","1","","2024.10.29. 05:48","2025-06-10 02:59:19"
"65","4568","","","헬스장서 음악틀고 전화하고 기구 정리 안하는 매너없는 사람들, 기성세대 아니면 MZ세대 들이더군요. 이래저래 기본이 망가진 나라입니다","truc****","22","1","","2024.10.29. 05:47","2025-06-10 02:59:19"
"65","4569","","","지네들도 늙으면 젊으이들 피해다닐건가 그래야지 내로남불은 이중인격이니까 그렇게 말하는 인간들 부모보고도 젊으니들 가는곳에 가지말라고 말은 했나 아니 말은했겠지 지네들 부모한테는 아무소리 안하고 남 부모만 오지말라 하는건 아니겠지","jki0****","1","0","","2024.10.29. 05:47","2025-06-10 02:59:19"
"65","4570","","","나이 드신 분들 말걸고 하면.. 스몰톡 정도로 받아넘기는 것도 좀 배워야죠.. 지금 젊은 분들 나중에 늙은 세대 되시면 똑같아질걸요..? 타인 입장을 이해야는게 의무는 아니지만, 사회구성원으로서의 최소한의 책임과 예의가 뭔지 생각해 봅시다.","epil****","4","0","","2024.10.29. 05:46","2025-06-10 02:59:19"
"65","4571","","","젊은 것들이 자기들이 세상의 주인공인냥 착각하고 자빠졌는데 이 나라를 이만큼 발전시킨 주역은 전부 60대이상 된 분들이다 어디 건방지게 60대이상 출입금지라는 토를 달고 지랄이야","kudr****","0","0","","2024.10.29. 05:44","2025-06-10 02:59:19"
"65","4572","","","여기 계시는 어르신 분들.. 젊은 사람의 입장에선 헬스장 다녀보면 노인혐오가 생길 수 밖에 없습니다.. 처음엔 제가 예민한가 보다 했지만 계속 상식 밖의 일들을 겪다보니 정말 싫어지더군요. 
누구나 나이드는건 당연하지만 나이드는 것이 타인에게 피해를 줄 수 있는 권리를 얻는 것은 전혀 아니랍니다.","wher****","7","4","","2024.10.29. 05:44","2025-06-10 02:59:19"
"65","4573","","","이제 곧 자식 분들에게 인사, 대화, 선물, 부탁, 칭찬 등 하지 마세요. ㅋ","ystu****","0","0","","2024.10.29. 05:43","2025-06-10 02:59:19"
"65","4574","","","나도.  나이먹었지만.   노인들은.  무식하고.  ㅠ  나이먹음. 죽어야. 한다","pol1****","3","11","","2024.10.29. 05:41","2025-06-10 02:59:19"
"65","4575","","","2짝들 얘기하는건가","eom5****","0","6","","2024.10.29. 05:37","2025-06-10 02:59:19"
"65","4576","","","차별을 안해야  하는데 업주입장에서는 안전사고위험,타인에게 말걸어 고객불편한것은 점주가 관리해야하는게 맞음.","ghan****","3","0","","2024.10.29. 05:36","2025-06-10 02:59:19"
"65","4577","","","우리들도...","susu****","1","0","","2024.10.29. 05:35","2025-06-10 02:59:19"
"65","4578","","","별 그지같은걸로 노노거리네ㅋㅋㅋ","rejo****","1","0","","2024.10.29. 05:34","2025-06-10 02:59:19"
"65","4579","","","제발 헬스장은 50세 이상 논네들은 출입금지하세요 하라는 운동은 안하고 꼰대질에 정치얘기만 하면서 민주당 욕만 하면서 젊은 사람들한테 2번 찍으라고 강요함","djmi****","2","12","","2024.10.29. 05:33","2025-06-10 02:59:19"
"65","4580","","","우리나라가 왜 이리 됐노!","n555****","2","0","","2024.10.29. 05:33","2025-06-10 02:59:19"
"65","4581","","","불편한 건 알겠지만 참 세상 삭막하네요","sj14****","4","0","","2024.10.29. 05:32","2025-06-10 02:59:19"
"65","4582","","","사장 마음이지뭐","doda****","0","0","","2024.10.29. 05:32","2025-06-10 02:59:19"
"65","4583","","","점차적으로 강화 되길. 그래야 실버 전용이  생겨 날테고 머잖아 분명 번창한다. 그때는보란듯이 30대 이전 NO !","bagg****","3","0","","2024.10.29. 05:31","2025-06-10 02:59:19"
"65","4584","","","실버끼리 놀면 될 것 아냐? 나도 60이지만 싫어하는 눈총받아가며 거기 가려는 좀비들 이해가 안된다. 민폐 끼치지 말고 좀비끼리 합창하고 카페가고 헬스가고 해라. 다 꼰대질로 보인다. 그리고 제발 샤워 좀 자주해라. 더러븐 년놈들 그 냄새 때문에 더 싫고 어울리지 않는다.","hone****","0","0","","2024.10.29. 05:31","2025-06-10 02:59:19"
"65","4585","","","죄앙가 만들어논 노소간. 빈부간.세대간 갈라치기 결과물 이지 사회주의를 만들어논 죄앙이가 뻔뻔하게 양산에서 국가연금으로 세금 한푼 안내고 살아가는것이 과연 한국 국민이냐","ots6****","3","1","","2024.10.29. 05:29","2025-06-10 02:59:19"
"65","4586","","","나라망친 역적 문재인의 갈라치기 효과...","nama****","17","1","","2024.10.29. 05:27","2025-06-10 02:59:19"
"65","4587","","","공공장소에서 누가 소리크게 키고 보니 나이많은 여성. 가만히 소리들어보니 중국말. 사람 많아도 아랑곳. 오늘도 혐오스탯 쌓고 갑니다","mint****","8","0","","2024.10.29. 05:27","2025-06-10 02:59:19"
"65","4588","","","정ㅂ말 참으로 병.ㅅㅣㄴ같은 나라
괜히 자살출산이 좋박은게아님","jaeh****","0","0","","2024.10.29. 05:25","2025-06-10 02:59:19"
"65","4589","","","배꼽 보이고, 몸매 드러나는 쫄복 입고,  땅바닥에 땀 흘리는 것을 ..... 기분 나쁘게 생각하는 사람이 있다면, 운동하는 사람을 출입 금지시켜도 되나? ... 기분 나쁘게 생각하는 사람을 출입금지 시켜야할 듯...","tige****","3","0","","2024.10.29. 05:23","2025-06-10 02:59:19"
"65","4590","","","내 나이 66 돼지띠! 집에 드럼치고.섹소폰샀는데 배울예정.서예붓구입했고,서각칼샀는데.배울데 만들어주셔요 헬스장은 됐고..나도 젊은애들  싫어요.","n555****","2","2","","2024.10.29. 05:23","2025-06-10 02:59:19"
"65","4591","","","투표라도 올바르게 잘했으면 그나마 대우라도 받지요 어르신들 ~","ride****","2","15","","2024.10.29. 05:21","2025-06-10 02:59:19"
"65","4592","","","나이들면 입을 닫아라..말조심 해야 한다..고집과 아집이 나이에 따라 저축된다..나는 아니다..라고 생각하는 사람일수톡 더 고집쟁이다..말보다..행동으로 모범을 보여라..젊은 사람들도 전부는 아니지만 바른 행동을 하는 나이든 사람들은 존경한다..입 닫고 지갑만 열면 최고지만..입만 닫아도 기본은 한다.","newf****","15","3","","2024.10.29. 05:18","2025-06-10 02:59:19"
"65","4593","","","60세이상 전용놀이터 카페개업하면 성공할것같은디..춤..당구.탁구,.7080라이브.등등.","n555****","2","0","","2024.10.29. 05:17","2025-06-10 02:59:19"
"65","4594","","","60세 이상은 석열장시켜라 살가치가 없다","wtbp****","1","2","","2024.10.29. 05:16","2025-06-10 02:59:19"
"65","4595","","","헬스장은 다치기 쉽고 카페에서는 시끄럽다","kkch****","0","0","","2024.10.29. 05:14","2025-06-10 02:59:19"
"65","4596","","","돈만 밝히는 장사꾼들이나 의새나 꼭 같지~","swet****","1","2","","2024.10.29. 05:11","2025-06-10 02:59:19"
"65","4597","","","요즘 노인들과 요즘 청춘들은 삶의 방식이 다르다는 것을 왜 깨닫지 못할까? 젊은 분들에게 인사, 대화, 선물, 부탁, 칭찬 등 하지 마세요! 그리고 사업체에 대해 인권위가 나설 일 또한 아니다. 사업체는 영업이익을 위해 고객을 선별해서 받을 권한과 자격을 가졌다.노인들의 천국은 없다!","keun****","1","4","","2024.10.29. 05:10","2025-06-10 02:59:19"
"65","4598","","","네이버 댓글 연령별 통계가 차별이다","home****","0","1","","2024.10.29. 05:08","2025-06-10 02:59:19"
"65","4599","","","나라가 미쳐 돌아가는구나.","kbc3****","7","0","","2024.10.29. 05:02","2025-06-10 02:59:19"
"65","4600","","","나도 늙은이지만 진짜 피해의식에 절어있는노인네들 많다.  대우받고 싶어하고 질서의식 없고 쓸데없이 모르는 사람에게 말 트려하고...
외로워서들 그런지 모르겠지만 주변사람들 한테 관심 좀 꺼주셨으면...","syle****","64","9","","2024.10.29. 05:01","2025-06-10 02:59:19"
"65","4601","","","제대로 된 사회라면 나이,성별 등으로 차별받지 않는 기본적인 권리가 보호받아야 한다. 이런걸로 차별받지 않도록 법으로 보호받아야함","ssot****","27","4","","2024.10.29. 04:59","2025-06-10 02:59:19"
"65","4602","","","이것 전교조 교육의 현실이다.  인성 교육을 전혀 않으니 이런 현상이 발생한다.  지금 초등학교에 동요를 가릋ㄱ지 않고 가정과 사회에선 아이들이. 성인 가요를 부르면 신동이리고 부른다.이게 인간 사회냐","keg7****","386","55","","2024.10.29. 04:56","2025-06-10 02:59:19"
"65","4603","","","내가 다니는 헬스장에도 어르신들 와서 기구 하나씩 차지하고는 옆에 다른 어르신들이랑 노가리 깐다. 뒤에 사람이 기다리건 말건 운동도 안하면서 앉아서 노가리 깐다. 같은 건물의카페에 가면 어르신들 4명이서 커피 2개 시켜놓고 몇시간씩 또 노가리깐다. 카페에서도 적당히 소근소근 이야기를 해야 하는데 공간에 자기만 있는듯이 크게 이야기를 한다. 기본적으로 노인들 중에 안하무인이 많다. 나이가 벼슬인줄 아는데
정신 좀 차리자.","dial****","42","14","","2024.10.29. 04:55","2025-06-10 02:59:19"
"65","4604","","","어린애들 많으면 들어가기 좀 그렇던데 ...나이제한 붙어 있으면 가지맙시다","dona****","4","0","","2024.10.29. 04:55","2025-06-10 02:59:19"
"65","4605","","","노인들 왜 굳이핼스장에 왜 가나??묻고싶다. 동내한바퀴 산책로걷기 뒷산오르기등 공기좋고 여우만만하게 운동하면 될일아인가?나의견해로는 노인에게  핼스장은 분진과 답답함 또 위험하고 해서 첨부당하다고 본다.","7005****","1","10","","2024.10.29. 04:52","2025-06-10 02:59:19"
"65","4606","","","노인네들 산업화시대때 아무렇지도 않게 성희롱 하던 습관 남아 있는건 사실이고  이런 노인들은 경고하고 못오게 해도 된다고 본다.","lhee****","5","4","","2024.10.29. 04:50","2025-06-10 02:59:19"
"65","4607","","","지금 노인들 세대도 노실버존 말걸지 마세요 하지않았나 되 묻고싶네 스피드하네","hwan****","0","0","","2024.10.29. 04:50","2025-06-10 02:59:19"
"65","4608","","","니들도 나이 먹는다","hi_j****","4","0","","2024.10.29. 04:49","2025-06-10 02:59:19"
"65","4609","","","노인분들이 눈치없이 말 많이시켜요.. 세워놓고 20분 말하면 끊을수도 없고 난감하죠.ㅠㅠ핼스장 측에서 70세 이상은 입장 불가 해서 맘은 아프더라구요.. ㅠㅠ","dudt****","3","1","","2024.10.29. 04:48","2025-06-10 02:59:19"
"65","4610","","","근데 진지하게 노카페존 노편의점존 이런건 유행 안하냐? 많아도 너무 많다","drea****","2","0","","2024.10.29. 04:48","2025-06-10 02:59:19"
"65","4611","","","너희들도 늙어봐라 ㅉ ㅉ.  그래 다 노인네들이 잘못했네. 지들 껴안고 비비고  홀딱벗다 시피하고  G, R 하는것은 괜찮고","dlry****","5","2","","2024.10.29. 04:45","2025-06-10 02:59:19"
"65","4612","","","노인들 입장도 충분히 공감합니다. 하지만 굳이 불필요한 말은 걸지 맙시다.","godc****","9","1","","2024.10.29. 04:39","2025-06-10 02:59:19"
"65","4613","","","요즘  식당에서 젊은 사람들이 더 시끄러움.","lkwp****","3","0","","2024.10.29. 04:39","2025-06-10 02:59:19"
"65","4614","","","젊은이들이여! 꼭 , 그랬어야만 했나?","ilai****","0","0","","2024.10.29. 04:31","2025-06-10 02:59:19"
"65","4615","","","동성애 죄악이라  말하는것이 차별이 아니라 이런것이 차별이다. 20~30 대 항상 거기 머무를것 같지? 순식간에 지나간다.","aero****","267","14","","2024.10.29. 04:29","2025-06-10 02:59:19"
"65","4616","","","사람마다 다 다르거늘~ 몇몇 사람들의 행동만 보고, 매도하는 쓰레기들아!! 요즈음 젊은것들 행동과 말뽄새는 괜찮고?????","1956****","0","0","","2024.10.29. 04:26","2025-06-10 02:59:19"
"65","4617","","","뭐라고 말을걸지 농담 쌈싸먹나 어른들도 괜한얘기안합니다   선입감에 말하기싫어 하는 습성 때문이죠 귀잖은거죠","yyye****","2","0","","2024.10.29. 04:21","2025-06-10 02:59:19"
"65","4618","","","차별이 맞지 다른 해결법을 찾이봐 누구나 늙잖아","jota****","18","1","","2024.10.29. 04:19","2025-06-10 02:59:19"
"65","4619","","","카페는 이야기를 하러가는곳아닌가?공부는 스터디카페가서 하세요.","stch****","491","29","","2024.10.29. 04:16","2025-06-10 02:59:19"
"65","4620","","","니들도 금방온다   늙음에시간이~~  생각보다 훨~ 빨리온다       앞으로 방송이나 그어떤 메체에서도    자영업 불황타령하면    더못참는다","seoj****","11","1","","2024.10.29. 04:15","2025-06-10 02:59:19"
"65","4621","","","지금 다니는 집앞 센터에 갑자기 노령층들 늘어나서 저녁시간대에도 운동하러 너무 많이 옴. 그게 나쁘다는건 아니지만, 끼리끼리 모여서 머신 앞에서 한참을 수다 떨고, 머신에 앉아서 쉬고 있거나 심지어 유튜브 영상을 보는 노인도 있음. 저녁시간대 사람 많고 루틴대로 운동 하는 사람들 많은데... 타인을 위한 에티켓 자체를 모름. 불쾌한 표시내기도 뭐한 노인들이라서 매니저나 트레이너들이 얘기하는것도 한계가 있는지 거의 포기 수준임. 오죽하면 각 머신마다, 앉아서 휴식 금지🚫 폰 사용 금지🚫 적힌 경고문을 붙여 놨을까 싶음.","ssmh****","18","8","","2024.10.29. 04:05","2025-06-10 02:59:19"
"65","4622","","","젊어도 언젠가는 늙는데 뭐가불편한지 이해는 되지만 입장을 제한하는 건 아니라고 생각한다.","wint****","157","21","","2024.10.29. 03:57","2025-06-10 02:59:19"
"66","4623","","","노키즈존이 생긴건 아이들이 싫어서가 아니고 아이들이 다른손님에게 피해를 줄 수 있는 것을 부모들이 아몰랑 내새끼 걸들지마 시전해서임","no_1****","526","12","","2024.10.26. 09:25","2025-06-10 02:59:58"
"66","4624","","","저분은 저분대로 훌륭하고 그렇다고 노키즈를 비난할건 아니라고 봄. 참고로 나도 7, 9살 키우는데 맘충 파파충 보고 있으면 X 같음.","yiho****","192","7","","2024.10.26. 09:31","2025-06-10 02:59:58"
"66","4625","","","응원합니다 아이들은 다컸지만 애들 육아에 힘든 시기에 커피 한잔이 먹고 싶어도 마음편하게 못먹었던 시기가. 생각나네요. 번창하세요","blac****","113","6","","2024.10.26. 07:24","2025-06-10 02:59:58"
"66","4626","","","하루11시간 몸으로 하는 일 하고 아이는 없지만 하루,이틀 맡아서 데리고 있어본 적 있어. 결론은 차라리 쉬지않고 이틀 일하는게 더 안힘들어. 애 키우는거..쉽지않아..","shin****","50","4","","2024.10.26. 09:23","2025-06-10 02:59:58"
"66","4627","","","페밀리레스토랑을 8년째 운영중인데 우리 부부도 아기 정말 이뻐라 해요. 2~3살 아이들은 엄마가 밥을 잘못먹을 정도로 천방지축이지만 잠시 우리 부부가 안아주고 있으면 우리도 아기보느라 행복하고 손님은 식사하시느라 고맙고 즐거워하세요. 반면 어떤 부모들은 식사후에도 대화하느라 아이를 방치하는 경우가 정말 많아요. 그럴땐 아이가 미운것이 아니라 그런 눈치없는 부모들이 미워집니다. 늘 경계선은 필요한 부분이기에 서로가 상식선에서 배려해주시면 정말 좋은 식당 문화가 될것 같아요.","hanm****","20","0","","2024.10.26. 11:19","2025-06-10 02:59:58"
"66","4628","","","‘예스 키즈 존’이라는 말이 ‘예의 없고 존중 없는’ 손님까지 참아준다는 뜻은 절대 아니다. 정말 공감되는 말이네요. 사장님들의 큰 결심과 앞으로의 나날을 응원합니다.","star****","18","0","","2024.10.26. 14:54","2025-06-10 02:59:58"
"66","4629","","","노키즈존은 애들이 문제가 아니라 개념없는 부모때문에 나오는거지 ㅋㅋㅋ","wnsg****","16","0","","2024.10.26. 11:44","2025-06-10 02:59:58"
