"article_id","comment_id","parent_comment_id","comment_type","content","author","like_count","dislike_count","reply_count","created_at","scraped_at"
"48","3157","","","애를 맥주집에 대려가는것부터가 생각이없는데?거기가서 뭐보여줄려고 데려가냐 애는 집에놔두고 먹던지 그게안되면 나오면 안되는거아닌가? 부모가 생각이없구만 애초에","skyl****","3","0","","2024.08.26. 16:57:14","2025-06-10 02:46:39"
"48","3158","","","술은 원래 어른에게 배우는 것  조기교육의 중요성을 아시는 참으로  훌륭한 부모님들","taem****","0","2","","2024.08.26. 16:57:13","2025-06-10 02:46:39"
"48","3159","","","머리에  뇌가 없는  사람들  많구나     자식 봐줄  사람 없으면    아이들  재우고   집에  지인들  초대해서   술을  마시던가  해야지","duph****","0","0","","2024.08.26. 16:56:48","2025-06-10 02:46:39"
"48","3160","","","왜이리들 나누지 못해서 안달인건지... 각자 사정이 있을수 있는것인데... 뭔 나라에 이렇게 소크라테스들이 많은지... 지들 생각만 맞다네... 사정이 있으면 아이들을 데리고 갈수도 있는 것이고 아이들 안된다고 붙어있으면 안가면 될것을 또 그런 얘기는 뭐하러 해서 서로서로 기분 나쁘게들 지내는지... 참 한심들 하다...","kshl****","4","4","","2024.08.26. 16:56:16","2025-06-10 02:46:39"
"48","3161","","","업주가 제대로 잘 조치한 것인데.... 음주로부터 청소년을 보호하는 것이 우리나라의 법이다. 어린이는 더욱 그러하지만, 왜? 어려서부터 음주에 대해 시청각 교육을 시키는가? 그리고 성인이라고 하더라도, 음주후에는 자신도 컨트롤이 되지 않는 것이 통상적인데, 하물며 그 어린이를 보호하고 단속할 수 있는가? 제대로 된 어른이라면, 맥줏집 사장님께 감사를 해야 한다.","fram****","4","0","","2024.08.26. 16:55:33","2025-06-10 02:46:39"
"48","3162","","","개념없는손님들많음","seat****","0","0","","2024.08.26. 16:55:26","2025-06-10 02:46:39"
"48","3163","","","아이 데리고 술집 갈 생각하는 부모가 쓰레기지","jazz****","0","0","","2024.08.26. 16:54:09","2025-06-10 02:46:39"
"48","3164","","","이거 보세요 맥주집에서 아이들을 왜 안받고 했는지 자신의 자녀들을 먼저 생각하고 말을 하시라   어른들은 아이는 뒤전이고  지들끼리 희희낙락  하고 아이는 무슨 놀이동산 놀러온 그런 행동을 하면서 대다수 사람들 눈살을 찌푸리게 합니다. 맥주집 사장도 오죽했으면 그랬을까  이해는간다","red6****","8","0","","2024.08.26. 16:54:07","2025-06-10 02:46:39"
"48","3165","","","맥주집이 아이데리고 가서 뭐 좋은거 보는 곳이라고..무슨 생각이야..분명 저기만 거절당한게 아닐거 같다","mand****","2","0","","2024.08.26. 16:54:00","2025-06-10 02:46:39"
"48","3166","","","정신병원 가야할 부모들이 왜이리 많을까","emyl****","2","0","","2024.08.26. 16:52:34","2025-06-10 02:46:39"
"48","3167","","","술집에 애좀 데리고 오지마세요 자기들은 술먹고 아이들은 위험하게 뛰고 지겨워서 몸을 틀고 저도 술먹으러 나갈데는 맡기고 나갑니다 맡길때 없음 안나가요","skyl****","6","0","","2024.08.26. 16:51:25","2025-06-10 02:46:39"
"48","3168","","","부모맞냐? 부모 맞으면 개다.","2788****","1","1","","2024.08.26. 16:51:11","2025-06-10 02:46:39"
"48","3169","","","술집은 19세 미만 출입긍지가 당연한거 아닌가요?","7241****","7","0","","2024.08.26. 16:50:35","2025-06-10 02:46:39"
"48","3170","","","몇년전에 실내포차를 갔다가 황당한경우를 봤다. 아이는 이제 한 4~5살정도 되보이는데 그 애엄마로 보이는 여자는 남,녀 십여명이 모여서 술을 먹고 있더라. 애는 이리갔다가 저리갔다가 심심해서 결국 옆에 테이블 빈자리에 누워서 자더라... 이걸보면서 참 착잡한 마음이 들었다.","don0****","4","0","","2024.08.26. 16:49:53","2025-06-10 02:46:39"
"48","3171","","","맥주집 (=술집)에서 아이를 출입시킨다면 그걸 신고를 해야 정상인 거 아닌가? 술집에 미성년자 데리고 출입이 가능한 것 자체가 이상하다. 한국은 tv에서 흡연 장면은 무슨 노이로제 걸린 듯 블러처리하면서 엄격해야 할 곳에선 느슨하더라. 좀 다른 이야기이지만 음주에 이렇게 느슨하게구니 음주운전이 만연해있는 것 아닐까.","goob****","6","0","","2024.08.26. 16:49:20","2025-06-10 02:46:39"
"48","3172","","","공원에서 술 담배 즉 마약 하지 맙시다.","ksfo****","0","0","","2024.08.26. 16:47:31","2025-06-10 02:46:39"
"48","3173","","","저런 부모니 자식교육 제대로 되었을리 없고 백퍼 다른 손님에 민폐 끼친다.","ryoh****","8","0","","2024.08.26. 16:46:59","2025-06-10 02:46:39"
"48","3174","","","오히려, 술집에 아이데려가는 것은 아동학대로 신고 가능하지 않을까?","hans****","5","0","","2024.08.26. 16:46:34","2025-06-10 02:46:39"
"48","3175","","","나도 아이 키웠지만 애들 데리고 술집와서 애들 방치하고 부모들끼리 술마시는거 보면 보기 안좋고 애들한테 안좋은 환경이라 눈살 찌푸려진다. 그 술 안마시면 큰일 나는 것도 아닐텐대. 노키즈존 찬성!","nix7****","195","0","","2024.08.26. 16:46:12","2025-06-10 02:46:39"
"48","3176","","","노키즈존이라는 발상자체가 웃기는 일. 왜 그럼 다 큰 성인들 술취해서 난동부리거나 주정부리면 그 사람도 다음에 받지 말아야 하는거 아닌가?","lang****","0","11","","2024.08.26. 16:45:52","2025-06-10 02:46:39"
"48","3177","","","아니 근데.. 맥줏집에 진심 왜 애를 데리고 가는지 모르겠다.. 나도 부모지만 아이 또래가 또 있는것도 아니고  애 하나만 덜렁 가면 애는 그게 재밌나? 그냥 애 핸폰쥐어주고 어른들 놀려는 욕심 아닌가..? 뭐 좋은 환경이라고 굳이 식당도 아니고 맥줏집에를;;;;","rich****","105","3","","2024.08.26. 16:43:36","2025-06-10 02:46:39"
"48","3178","","","애는 무슨 죄냐? 지들 술먹고 떠들 동안 뭐하고 있으라고? 게임이나 하고 있으라고?","nice****","5","1","","2024.08.26. 16:42:49","2025-06-10 02:46:39"
"48","3179","","","애초에 맥주마시러가는곳에 아이를 데려가는것 자체가 잘못된거다!!!!!!!!!!!!!!! 테블릿 쥐어주고 술퍼마시는 모습 보여주려고? 애엄마나 애아빠 정신상태가 이모양이니 애한테 교육을 못하는거다!!!!!!","rhkd****","5","0","","2024.08.26. 16:42:31","2025-06-10 02:46:39"
"48","3180","","","어린이들 출입하는 곳은 문신 노출하면 입장 못하는 법도 만들어주세요 .","ksra****","0","0","","2024.08.26. 16:42:27","2025-06-10 02:46:39"
"48","3181","","","흡연구역과 19금 성인 영화관에 애 데려가면 안되는 것과 차이도 없는 것 같은데 왜 저러냐... 아동 학대로 신고해도 될 것 같네... --;","reda****","1","0","","2024.08.26. 16:42:12","2025-06-10 02:46:39"
"48","3182","","","술집에 애를 왜 데려가냐... 카페나 음식점이면 이해라도 하겟는데 호프집에 애기???","news****","1","0","","2024.08.26. 16:42:12","2025-06-10 02:46:39"
"48","3183","","","술집은, 표시가 없어도 당연히 노키즈존 아닌가?","idre****","1","0","","2024.08.26. 16:41:55","2025-06-10 02:46:39"
"48","3184","","","술집에 애를 왜 데려가?","l002****","0","0","","2024.08.26. 16:41:14","2025-06-10 02:46:39"
"48","3185","","","저런 애들 받으면 꼭 싸움나고 사달이 남. 점주가 현명한 판단 했고 애초에 맥주집에 애들은 왜 데려감? 애들이 있기에는 시끄럽고 욕도 많이 하고 이상한 별 이야기 다하는데 쯧쯧","efbn****","520","6","","2024.08.26. 16:25:36","2025-06-10 02:46:39"
"49","3186","","","수원꺼 베껴놓고는 뭔 치적이라고 홍보성 기사가 뭐 이로도 넘치는 지..","wint****","0","1","","2024.08.28. 12:30:35","2025-06-10 02:46:58"
"49","3187","","","개장한지 일주일인데 무슨 mg타령. 근데 mg갈수록 안좋은 이미지 되네. 돈 막쓰고 회식비 돈으로 달라는","","","","","","2025-06-10 02:46:58"
"49","3188","","","돼멜디가 타는것만으로도 테러다...","bmmi****","1","1","","2024.08.28. 06:56:54","2025-06-10 02:46:58"
"49","3189","","","여엄병","dong****","0","0","","2024.08.28. 06:16:55","2025-06-10 02:46:58"
"49","3190","","","방금 뉴스에도 체코에 젊은 아가씨 인생샷 찍다 80미터 아래로 추락해 숨짐","alru****","0","1","","2024.08.28. 06:12:56","2025-06-10 02:46:58"
"49","3191","","","ㅉ","bong****","0","0","","2024.08.28. 06:05:57","2025-06-10 02:46:58"
"49","3192","","","방구석에서 라면에 소주나 빨던 저학력 저소득 뜰.탁들 다 기어 나와서 댓글질이노ㅋㅋ부럽니?","engl****","1","2","","2024.08.28. 05:57:28","2025-06-10 02:46:58"
"49","3193","","","일은 하기 싫고 눈은 높아졌고, 남들 하는것은 다하고 싶고, 그러면서 원칙을 따지는....어찌보면 MZ세대들이 문제가 있는게 아니라.그들 부모 세대들이 그리 키운게 더 잘못 됐다고 생각한다.","xcar****","7","5","","2024.08.28. 05:57:12","2025-06-10 02:46:58"
"49","3194","","","2030 여성ㅋㅋㅋ 저렇게 호캉스하고 즐기는데 결혼할 땐 3천만원 가져오는게 국룰! 하지만 남자는 3억은 있어야한다구요!","7thd****","21","1","","2024.08.28. 05:48:07","2025-06-10 02:46:58"
"49","3195","","","5세후니 광고하는겨?","leeh****","0","1","","2024.08.28. 05:29:08","2025-06-10 02:46:58"
"49","3196","","","관리하는 직원들 잘 가려 뽑아라. 민주당에 사주받고 기구에 구멍뚫어 놓는다","dann****","6","4","","2024.08.28. 05:28:55","2025-06-10 02:46:58"
"49","3197","","","찢셰셰밍이 보이면 알라뷰라는 그 뇌 양심 투게더로 터진 늙고 흉포한 개들은 공산 그 잡채","joel****","6","4","","2024.08.28. 05:14:40","2025-06-10 02:46:58"
"50","3198","","","'노키즈존’ 식당이 피하고 싶은 것은 사실 ‘아이’가 아니라 ‘그 아이의 부모’일 것이다. ᆢ완전 공감ᆢ예의 없는 부모에 버릇 없는 아이ᆢ이게 세상의 이치입니다","bmsa****","12","0","","2024.09.06. 07:21","2025-06-10 02:47:09"
"50","3199","","","요즘 젊은 부모들은 다 많이 배우고 나이도 어느정도 들어서 자식을 낳기 때문에, 아이들 예절교육은 잘 시키는 거 같던데요? 일부 그렇지 않은 부모도 있겠지만요.","wjdt****","","","","","2025-06-10 02:47:09"
"52","3200","","","완전 개판이구만","jin2****","33","2","","2024.09.09. 18:51","2025-06-10 02:48:20"
"52","3201","","","사람이 먼저다 개를 우선시하는 인간은 정상이 아니다","kore****","30","6","","2024.09.09. 18:57","2025-06-10 02:48:20"
"52","3202","","","세상이 미쳐돌아가고 있다는거지. 네발달린 짐승을 애키우는 무모차에 태우면 개가 사람인가 사람이 개인가?","juns****","28","7","","2024.09.09. 19:12","2025-06-10 02:48:20"
"52","3203","","","참 창피한 노릇입니다. 반려견이 예쁘고 귀여워 죽겠는 건 이해못할바 없으나 분명한 것은 개는 개일 뿐입니다. 아무리 개 이상의 정성과 애정을 쏟더라도 그 개가 막내가 된다거나 애기 등이 될 수는 없다고 생각합니다. 개는 개입니다.","ydg8****","13","2","","2024.09.09. 20:47","2025-06-10 02:48:20"
"52","3204","","","집단정신병에 가까움.","rock****","12","1","","2024.09.09. 19:31","2025-06-10 02:48:20"
"52","3205","","","신생아가 개 만도 못한 나라....개한민국....ㅋㅋㅋㅋ","proj****","11","1","","2024.09.09. 18:57","2025-06-10 02:48:20"
"52","3206","","","개와 고양이의 에비 에미인 윤석열과 김건희의 빛나는 업적이다.","gran****","10","1","","2024.09.09. 19:21","2025-06-10 02:48:20"
"52","3207","","","개비린내 엄청남. 본인들은 모름. 고양이 키우는 사람들은 구석구석 고양이털.","kimm****","9","1","","2024.09.09. 20:50","2025-06-10 02:48:20"
"52","3208","","","진짜 가관이 아닐수 없다 멀리서 유모차 끌고 오는 젊은 부부들 옆에 스쳐지나갈 때 보면 개를 앉혀놨더라 처음에는 놀랐지만 이제는 그냥 그러려니 한다 오히려 아기를 앉혀놓은게 더 신기할정도로 개들 앉혀놓은게 많고 가슴팍 유아띠도 요즘은 개를 안고 가더라 간혹 이런 생각이 든다 저 개들이 시간 지나면 펑하고 사람으로 변할려나 하고ㅉㅉ그들이 4ㆍ50대 되면 한민족은 극소수에 아마 타민족 지배받고 살 수도 있을거란 생각들더라 자승자박 자업자득 이다","gree****","13","6","","2024.09.09. 19:03","2025-06-10 02:48:20"
"52","3209","","","한국사람들 특히 여자들 개나 강아지를 사람으로착각하고  키우고 있다 웃기는 일이다","dhck****","8","1","","2024.09.09. 23:24","2025-06-10 02:48:20"
"52","3210","","","한심한 인간들~~","9000****","8","3","","2024.09.09. 18:51","2025-06-10 02:48:20"
"52","3211","","","대통령이 개판치니 따라서 개판치네","jsc3****","7","2","","2024.09.09. 22:25","2025-06-10 02:48:20"
"52","3212","","","아파트 온천지 다리들고 오줌. 똥싸네개세상이네","2red****","6","1","","2024.09.09. 19:38","2025-06-10 02:48:20"
"52","3213","","","사람이 개를 산책시키는건가.. 개가 사람을 산책시키는건가","reki****","5","0","","2024.09.09. 22:27","2025-06-10 02:48:20"
"52","3214","","","개 끌고 다니는 것들은 거르고 지나친다~","c01o****","5","1","","2024.09.09. 19:35","2025-06-10 02:48:20"
"52","3215","","","견주님들...보도에 개오줌 좀 못누게 할수 없나요?...큰 놈은 콸콸 쏴던데...","kimi****","4","0","","2024.09.09. 23:52","2025-06-10 02:48:20"
"52","3216","","","대한민국 개판 국짐 부수 태통령 윤거니.바끄네 
애가 없지. 
윤거니 개한테 빠저 살고","dlfr****","4","0","","2024.09.09. 19:37","2025-06-10 02:48:20"
"52","3217","","","윤떵렬이와 김거니가 아이는 안낳고 개만  키우니 그럴수밖에대한민국은 2022년부터 🐕 공화국  되였다.","zbnn****","4","0","","2024.09.09. 18:57","2025-06-10 02:48:20"
"52","3218","","","개들은 말안들으면 슬리퍼로 줘패면서 키워야지 개가 더 상전이여","love****","5","2","","2024.09.09. 22:54","2025-06-10 02:48:20"
"52","3219","","","저게 강아지를 위하는건지 학대하는건지 기본적인 생각조차 안해보는 사람들이 애견인인척 꼴값 떠는거지. 하루종일 집안에 갇혀지내는 강아지들을 잠간 나왔을때만이라도 걷게 해줘야지. 그마저도 못걷게 하는게 학대가 아닐까?","kusa****","4","1","","2024.09.09. 20:05","2025-06-10 02:48:20"
"52","3220","","","반려견 프로 자꾸 나오고, 언론이 자꾸 부추긴다~ 이러다 개.고양이가 인간보다 더 상전인 시대가 온다.","loy9****","3","0","","2024.09.09. 22:28","2025-06-10 02:48:20"
"52","3221","","","근데 새끼강아지도 아니고 어느정도 산책을 시켜야 정상아님?? 애견인인지 의문.. 애초에 산책이라는걸 안시키다 나갈때 저러는거같은데 애완견한테도 학대임..집에서 아무리 활발하게 움직여도 활동량제어가 집에서하는건 한계가있음.. 노견에 힘없는 경우는 충분히 이해하지만 .. 제발 정상적인애들은 태우지맙시다..","jiki****","3","0","","2024.09.09. 20:25","2025-06-10 02:48:20"
"52","3222","","","개에 미쳐잇는데 애를낳아?","para****","3","0","","2024.09.09. 19:18","2025-06-10 02:48:20"
"52","3223","","","개들천국인 개한민국!!","ikth****","3","0","","2024.09.09. 19:09","2025-06-10 02:48:20"
"52","3224","","","개모차 끄는 사람들은 진짜 개가 사람인줄 알고 있던데...식당에 개동반금지 써놔도 개모차 옆에두고 밥먹고..
진짜 개가 중하면 집에서 배달시켜 먹던가 해라 민폐다","ebbu****","4","2","","2024.09.10. 05:26","2025-06-10 02:48:20"
"52","3225","","","나라가 개판이니 개들이 판치는구나  개 세금추진해야지  그돈으로 사람을 도와주면 그게 행복이다  욕  개땡  개세땡  나라가 이모양이냐","oes1****","3","1","","2024.09.09. 23:59","2025-06-10 02:48:20"
"52","3226","","","접대부가 개나 키우니까 그러지 뭐.","yoon****","3","1","","2024.09.09. 22:56","2025-06-10 02:48:20"
"52","3227","","","인스타 안하다가 요즘 인스타하는 30대중반인데 초중고 대학 동기들 결혼한사람들 생각외로 많던데...연애도 많고 싱글은 별로없음....","bycp****","3","1","","2024.09.09. 18:56","2025-06-10 02:48:20"
"52","3228","","","사람 애기=안 귀여움, 개 =귀여움","nz******","2","0","","2024.09.11. 10:32","2025-06-10 02:48:20"
"52","3229","","","나도 자식있는 사람이지만 솔직히 애 키우는게 보통일인가. 간도 쓸개도 다 빼놓고 정신없이 휘돌아치길 십여년, 그래도 아직 고지를 반밖에 못 올랐다는게 함정... 옛날처럼 열두서넛 먹으면 공장가서 자기 밥 벌어먹던 시절도 아니고.. 서른넘어 결혼까지 풀로 뒷받침해줘야 인간된다는 한국에서, 내 애야 이미 낳았으니 키우지만 다른사람한테까지 낳으라곤 말 못하겠다. 다들 본인의 마음가는대로 하세요. 같은 환경이라도 또 낳을사람은 낳더라.","cara****","2","0","","2024.09.09. 23:05","2025-06-10 02:48:20"
"52","3230","","","개가 상전이 된 시대....","sgmo****","2","0","","2024.09.09. 19:16","2025-06-10 02:48:20"
"52","3231","","","지나가는 할머니 왈 세상이 개판이네","lily****","3","2","","2024.09.09. 19:42","2025-06-10 02:48:20"
"52","3232","","","개모차 ㅋㅋㅋㅋㅋ","jael****","2","1","","2024.09.09. 19:35","2025-06-10 02:48:20"
"52","3233","","","개사랑 건희  때문 개사랑 석열 때문 나라가 개판","simp****","2","1","","2024.09.09. 18:59","2025-06-10 02:48:20"
"52","3234","","","통탄해야할 일이로다","yhj4****","1","0","","2024.09.09. 23:16","2025-06-10 02:48:20"
"52","3235","","","참 재미난 세상이네 ㅎㅎㅎㅎ","tag1****","1","0","","2024.09.09. 23:07","2025-06-10 02:48:20"
"52","3236","","","20년 후 외국인들이 봤을때. 서울 한복판에도 젊은이는 찾아보기 힘들고 늙은이만 그득하고 지팡이 대신에 개모차를 끌고 다녀서 노인과 바다도 아니고 ""노인과 개"" 를 상징으로 여길듯. 게다가 노인들 아프거나 고독사로인해 구급차 싸이렌소리가 허구한날 도처에서 들리고 한순간에 주인 잃어버린 수만마리의 개들이 여러 무리로 나뉘어 영역다툼 하고 싸움에서 이긴 무리는 먹을 음식이 없어 다른개를 잡아먹는 흔한 모습에 경악해 할듯.","hby1****","1","0","","2024.09.09. 19:58","2025-06-10 02:48:20"
"52","3237","","","반려동물 기르는건 자유겠지만 아무리 그래도 ""아이가 있으면 지금처럼 개를 돌보기는 어려울것""이라니  아이가 개보다 못한건 아니잖아요.너무 하세요.","ilsi****","1","0","","2024.09.09. 19:13","2025-06-10 02:48:20"
"52","3238","","","그나저나 다 뎌 죽겠는데 뭔 출산율?","buyn****","1","0","","2024.09.09. 18:51","2025-06-10 02:48:20"
"52","3239","","","술집접대부쥴리는개만낳느냐","wodn****","1","1","","2024.09.09. 20:03","2025-06-10 02:48:20"
"52","3240","","","개들이 뛰어 다녀야지 에휴..개 키우는 사람으로 서도 이해하기 힘드네 개판이네 개판","00wi****","1","1","","2024.09.09. 19:32","2025-06-10 02:48:20"
"52","3241","","","엘베 타는 유모차 반이상이 개모차인듯. 개태운다고 정작 사람 타기 어려운 현실이 되어감.","chuc****","1","1","","2024.09.09. 19:27","2025-06-10 02:48:20"
"52","3242","","","외노자 공화국,골목장사 공화국 개 공화국.","soon****","1","1","","2024.09.09. 18:51","2025-06-10 02:48:20"
"52","3243","","","하찮은 인간들이여, 개님들께서 함께 살아주는것만으로도 영광으로 여겨라. 너희들 같으면 인간들과 함께 살고 싶겠냐? 개님들이 인자하고 선해서 참아가며 인간들과 살아주는줄도 모르는것들이. 쯔쯔.  인간의 존엄성? 그게 말이 되는 말이냐? 인간이 뭐가 존엄한데? 동물계 최악의 동물이 인간이다. 윤석렬을 봐. 무슨 말인지 금방이해되지?","anti****","0","0","","2024.09.11. 15:03","2025-06-10 02:48:20"
"52","3244","","","대통령 먼저 패세요","hdy7****","0","0","","2024.09.11. 10:31","2025-06-10 02:48:20"
"52","3245","","","공원 가는길 개똥천지","jumb****","0","0","","2024.09.10. 06:25","2025-06-10 02:48:20"
"52","3246","","","비정상 이 정상을 비정상으로 몰고가는 시대...정치인들아.  정신차려라. 이러다 개 ㅅ 한테 선거권 주어질라.","jjok****","0","0","","2024.09.09. 23:52","2025-06-10 02:48:20"
"52","3247","","","요즘 OOO이 자기가 사람보다 서열이.높은 줄 알더라고. 그런 개.볼 때마다 발로 한방 차고 싶어. 개모차 모는 사람 나는 진짜.극혐한다.","hora****","0","0","","2024.09.09. 23:24","2025-06-10 02:48:20"
"52","3248","","","개를 언제부터 못 먹나요?","hunn****","0","0","","2024.09.09. 23:14","2025-06-10 02:48:20"
"52","3249","","","머칠전에 강아지사서 욕도 못쓰겠네 ㅋ  이쁘니까 개모차는 정서적으로 아직은 용납이 안되지만 이해는감 끌고다니기 힘들어 ㅠ","magn****","0","0","","2024.09.09. 23:09","2025-06-10 02:48:20"
"52","3250","","","아기는 언졔고 말 하지만 ᆢ개는 ᆢ끝까지 컹 !","mint****","0","0","","2024.09.09. 22:57","2025-06-10 02:48:20"
"52","3251","","","개판입니다..","basb****","0","0","","2024.09.09. 22:56","2025-06-10 02:48:20"
"52","3252","","","개를 좋아하는 것은 그렇다치고 개모차를 끌고 다니는 OOO들이 왜 이렇게 많나?","dwku****","0","0","","2024.09.09. 22:55","2025-06-10 02:48:20"
"52","3253","","","나라가 개판이라 그러네 제대로,청신 박힌 인간이 없네","ki07****","0","0","","2024.09.09. 22:53","2025-06-10 02:48:20"
"52","3254","","","그래서 개한민국","nice****","0","0","","2024.09.09. 22:53","2025-06-10 02:48:20"
"52","3255","","","개프로 폐지해라 동물농장부터  스발  mc4명이 필요하나  잡담 부터  하는일  뭐있노  다리꼬꼬 반쯤 누워서 시청 하던데","anan****","0","0","","2024.09.09. 22:52","2025-06-10 02:48:20"
"52","3256","","","OOO이 아니고..개네..그냥.ㅋ","frit****","0","0","","2024.09.09. 22:52","2025-06-10 02:48:20"
"52","3257","","","한국은 언젠가는 사람나라가 아닌 개들의나라로 바껴질거다.","qpla****","0","0","","2024.09.09. 22:48","2025-06-10 02:48:20"
"52","3258","","","개하고 같이사는 여성은 개년이네","ohks****","0","0","","2024.09.09. 22:46","2025-06-10 02:48:20"
"52","3259","","","요즘 삶은 소대가리도 싣고 다니더라. 이게 나라냐?","2001****","0","0","","2024.09.09. 22:45","2025-06-10 02:48:20"
"52","3260","","","문재인도 저기에 탑승 시키자 개XX니까ㅎ","jung****","0","0","","2024.09.09. 22:45","2025-06-10 02:48:20"
"52","3261","","","모든게 개판인 세상.","vip1****","0","0","","2024.09.09. 22:43","2025-06-10 02:48:20"
"52","3262","","","군대가는게 애 낳는고통보다 덜하다고 무시했으니 이제 애 안낳을꺼면 군대가면 되겠네요 당신들이 바라는 남녀평등사회","lsh1****","0","0","","2024.09.09. 22:35","2025-06-10 02:48:20"
"52","3263","","","사회적인 사고관이 문제일듯..내년쯤엔 신생아 특례대출보다는 신생견 특례대출 공약 내면 표는 더 만을꺼고.. 정치인들 정책 만들거고.. 개 상속이슈가 곧 나올듯하고.. 인간이 인간윤리를 스스로 무너 뜨리는 프로세스가 진행중인데..세계적 추세지만 유난히 우리나라가 너무 빠름빠름.. 다 이 모든것이 내 잘못 입니다...이 모든것이 내 잘못 입니다...이 모든것이 내 잘못 입니다...","onej****","0","0","","2024.09.09. 21:33","2025-06-10 02:48:20"
"52","3264","","","미친 개같은 세상","iceh****","0","0","","2024.09.09. 20:24","2025-06-10 02:48:20"
"52","3265","","","정신병자다 자기새끼를 키워야지 사람 물어 뜯어 죽이는 동물을 키우다니 한심한것들","haja****","0","0","","2024.09.09. 20:13","2025-06-10 02:48:20"
"52","3266","","","세상 살다살다 별 희얀한 일이 다있군..개모차~~ㅋㅋㅋ","jdb9****","0","0","","2024.09.09. 20:10","2025-06-10 02:48:20"
"52","3267","","","이젠 개들도 금수저  흙수저로 분리되는구나 ...","ohin****","0","0","","2024.09.09. 20:03","2025-06-10 02:48:20"
"52","3268","","","윤도리 도리 김건이땜시 나라가. 개빤세상이. 되는구나
애늘 낳아봤야
군대를갔다왔냐

&&&&&&&들","ksu4****","0","0","","2024.09.09. 19:54","2025-06-10 02:48:20"
"52","3269","","","미친 나라 폼생폼사","misa****","0","0","","2024.09.09. 19:53","2025-06-10 02:48:20"
"52","3270","","","건희 덕이여!","dbgu****","0","0","","2024.09.09. 19:51","2025-06-10 02:48:20"
"52","3271","","","개가 판을치니 모든것이 개판이네~","kpsg****","0","0","","2024.09.09. 19:49","2025-06-10 02:48:20"
