"article_id","comment_id","parent_comment_id","comment_type","content","author","like_count","dislike_count","reply_count","created_at","scraped_at"
"15","1659","","","우리  국방력 강화를 위해서 결단을 내려야할듯 제일선에. 줌마부대 제이선에 노인 부대  이렇게 편성. 그들의 강심장을 국가방위에  활용하면. 우린 전하무적. 줌마 노인들의 철판의심장을 감히 누가대적 하리오","sog3****","0","0","","2024.06.15. 14:17","2025-06-10 02:29:04"
"15","1660","","","다리 닦는데 수건 1장, 머리 말리는데 수건 1장, 상체 닦는데 수건한장... 가뜩이나 영업 안되느데 진상떠니업주는 얼마나 야마 돌까??
회비를 좀 올리면 아줌마는 안온다,,,","l851****","0","0","","2024.06.15. 13:49","2025-06-10 02:29:04"
"15","1661","","","소수의 노매너로 세계적 오해를","lmh6****","0","0","","2024.06.15. 13:40","2025-06-10 02:29:04"
"15","1662","","","전라도 아줌마가 맞는데..목욕탕 여탕에 수건 없는 이유 습관적으로 훔쳐감. 그래서 부자 됐는지 묻고 싶다","gisa****","0","0","","2024.06.15. 13:14","2025-06-10 02:29:04"
"15","1663","","","왜 여탕에는 수건이 1인당 하나만 지급되는가와 같은 이유라고 본다 대접 받고 싶으면 그에 걸맞게 행동해야하는게 당연함","bkyo****","0","0","","2024.06.15. 13:01","2025-06-10 02:29:04"
"15","1664","","","나이들고 여성이라 비난하는게 아니라 유독 그 성별의 그 나이대가 그런짓을 많이 하니까 비난 받는거다","bkyo****","0","0","","2024.06.15. 12:54","2025-06-10 02:29:04"
"15","1665","","","아줌마나 어린이 출입금지는 하면서 왜 반려견 출입 금지는 안하는지 모르겠음","2hka****","0","0","","2024.06.15. 12:13","2025-06-10 02:29:04"
"15","1666","","","아줌마들 긁혔나","yung****","0","0","","2024.06.15. 12:06","2025-06-10 02:29:04"
"15","1667","","","아줌마만 그랬으니까 나쁜손님=아줌마가 된겁니다, BBC가 이해하기엔 한글이 너무 수준높고 의미가 심오하지, 관심꺼라 단순한 문제가 아니다","4thr****","0","0","","2024.06.15. 11:57","2025-06-10 02:29:04"
"15","1668","","","이런식의  차별내지 형오는 결국 사회를  병들게 하죠 물론  무례한  아줌마 아저씨들 각성해야죠.","engl****","0","1","","2024.06.15. 13:48","2025-06-10 02:29:04"
"15","1669","","","우리 윤석열 이는 해외여행 중","rfso****","0","1","","2024.06.15. 12:29","2025-06-10 02:29:04"
"15","1670","","","이헬스장 문닫겠다.기대해도좋아요.","sinc****","0","1","","2024.06.15. 11:59","2025-06-10 02:29:04"
"15","1671","","","맞는말인데 아중마라는 표현보단 진상고객이라고 했으면 좋았을텐데","leeh****","0","1","","2024.06.15. 11:46","2025-06-10 02:29:04"
"16","1672","","","남자들은 '아저씨'라고 불리면 기분이 좋든 안 좋든 그냥 넘어가는데, 여자들은 '아줌마'라고 불리면 왜 그렇게 발작을 하냐? 남자들은 20대에도 '아저씨'라고 불리는데... 하여튼 한국여자들 정말 웃겨.","pres****","1","2","","2024.06.16. 10:49","2025-06-10 02:29:34"
"16","1673","","","아줌마를  모두 나쁜 이미지로 모두 일반화시키는건 잘못이지만 얌체같고 남배려없는 아줌마 아재들 반성들 해야합니다 젊은이들에게  본보기는 못될망정 같은 아줌마가 보기도 부끄러울때 많습디다","bake****","2","0","","2024.06.16. 08:58","2025-06-10 02:29:34"
"16","1674","","","아줌마가 문제가 아니라 사람 기본인성이 문제입니다.","saga****","8","0","","2024.06.16. 08:56","2025-06-10 02:29:34"
"16","1675","","","노 2찍이존 나와야할듯","didi****","1","0","","2024.06.16. 08:55","2025-06-10 02:29:34"
"16","1676","","","세상이 이상하게 돌아가는군..노아저씨존도 곧 나오겠네","yh09****","3","0","","2024.06.16. 08:30","2025-06-10 02:29:34"
"16","1677","","","BBC 기사 쓸게그렇게 없냐? 니네 나라 인종차별이나 하지마라","khg8****","4","3","","2024.06.16. 08:23","2025-06-10 02:29:34"
"16","1678","","","3,40대에 미혼인데 아줌마 취급 당하면 억울할듯","jjtw****","0","1","","2024.06.16. 08:04","2025-06-10 02:29:34"
"16","1679","","","빨래는 아줌마 맞는것 같지만 비품 훔치는건 글쎄...동네 목욕탕에도 심힌 아줌마들 계시긴 한데 대부분 할머니들임

..","jjtw****","0","0","","2024.06.16. 08:02","2025-06-10 02:29:34"
"16","1680","","","대한민국 아줌마를 몰라서 저런다.","dada****","2","1","","2024.06.16. 07:56","2025-06-10 02:29:34"
"16","1681","","","무례한건 나이와 상관없이 인성교육을 잘못 받은 탓이다","wjdx****","9","0","","2024.06.16. 07:48","2025-06-10 02:29:34"
"16","1682","","","30대 후반이면 여자로써 최고의 전성기 아닌가요?","at41****","1","4","","2024.06.16. 07:47","2025-06-10 02:29:34"
"16","1683","","","나도 아줌마지만 아줌마가 무섭다3명이상 모임 당해낼수가없는 천하무적","seis****","2","0","","2024.06.16. 07:46","2025-06-10 02:29:34"
"16","1684","","","여자랑 아줌마는 확실히 다름","audw****","1","0","","2024.06.16. 07:44","2025-06-10 02:29:34"
"16","1685","","","영국 아줌마들은 헬스장에서 자기 빨래 가져와서 한두시간씩 남의 뜨거운 물을 사용하는 경우가 없으니 저런 기사를 쓰겠지 ,,,","gahn****","3","0","","2024.06.16. 07:21","2025-06-10 02:29:34"
"16","1686","","","남자든 여자든 비매너,비상식적인 사람들 많다. 근데 굳이 아줌마라는 단어를 사용해 특정계층 이미지 흠집내는건 좋아보이지 않는다 그것도 가게장사하는 사장이 저런 마인드라니..","myle****","35","4","","2024.06.16. 06:15","2025-06-10 02:29:34"
"16","1687","","","헬스장에서 시끄럽게 떠들고 샤워장에서 빨래하는 몰상식한 아줌마들 때문에 헬스장 질떨어지니 거부할 수도 있다고 본다!","0des****","10","10","","2024.06.16. 06:08","2025-06-10 02:29:34"
"16","1688","","","헬스장에서는 여러명이 이용하는 공공개인 공간이다. 깨끗치못한 사람들 다른 사람들 눈살찌프릴수있는사람들은통제해야한다","shar****","5","1","","2024.06.16. 06:03","2025-06-10 02:29:34"
"16","1689","","","문제없다. 뉴스생성하려는 노력이 보이는구나.","shar****","2","0","","2024.06.16. 05:59","2025-06-10 02:29:34"
"16","1690","","","나라마다  특정 나이나 성별 혹은 그룹을 비하해서 부르는 명칭들이 있지 영국은 유난떠는 엄마들 'Bloody Mothers'라고도 하고, 시기질투하는 여자들 깍아 부르고 싶을때 'ladies'라고도 하고, 많은데~ 아줌마도 상식적이고 이타적인 좋은 아줌마 많음. 저 헬스클럽 이기적인 몇 몇분들만 질타할 일","kyun****","11","0","","2024.06.16. 05:45","2025-06-10 02:29:34"
"16","1691","","","구월동 미리내시장역점","airm****","0","1","","2024.06.16. 05:23","2025-06-10 02:29:34"
"16","1692","","","차라리 특정 시간대에 아줌마 받지","4you****","0","0","","2024.06.16. 05:21","2025-06-10 02:29:34"
"16","1693","","","여자 전용에 가면됌 멀 힘들게 하냐 ㅉ","yju7****","0","0","","2024.06.16. 05:03","2025-06-10 02:29:34"
"16","1694","","","그냥..  훔치지마세요.. 뭐 자원봉사도아니고 자비들여서 먹고살자고 장사하는데 비품 훔처가서 재정에 영향주면 좋아할사람이 어딨겠습니까. 오죽하면 그럴까.. 그냥 훔치지마세요. 중국입니까? 피해자한테 너무한다 욕하기전에.. 그냥 훔치지마세요","haru****","6","0","","2024.06.16. 04:17","2025-06-10 02:29:34"
"16","1695","","","여자 끼리 이해하면서 좀 살아라...  ㅉㅉㅉ...","ace3****","0","0","","2024.06.16. 04:06","2025-06-10 02:29:34"
"16","1696","","","예견된 수순 아닌가. 남자 금지 디저트 가게, 노키즈존 카페, 시니어 금지, 아저씨 금지 술집 어떤 특정 계층을 차별하는 가게는 이미 한 바가지다. 다른 케이스들도 다 모두가 잘못해서 생긴건가. 아니다. 일부로 인해 생긴거다. 그렇다고 무시할 수도 없다. 내가 자영업을 하진 않지만, 굳이 자기 예비 손님층을 무조건 막을만큼 가벼운 일은 아니라는 소리다. 하나의 원인은 진상에 대한 자영업자의 보호수단이 부재하거나 미비한 것일 것이고, 또 다른 하나는 서로간의 믿음이 그만큼 없어졌다는 소리다.","sos8****","6","2","","2024.06.16. 03:42","2025-06-10 02:29:34"
"16","1697","","","생각들이 없어 지들 어머니가 아줌마인데 아줌마가 싫다니 지들 어머니를 욕하는 꼴인데  아님 지들 어머니가 아줌마가 아닌  꼬부랑 할머니인가","clev****","1","6","","2024.06.16. 03:41","2025-06-10 02:29:34"
"16","1698","","","댓글들 웃기네 당신들 어머니는 아줌마 아니냐  아줌마 전체를 혐오하는 듯한 댓글이 왤케 많냐 당신들 어머니를 욕하는 꼴이니 진상 아줌마가 싫다해야 맞지","clev****","6","4","","2024.06.16. 03:32","2025-06-10 02:29:34"
"16","1699","","","나는 이해안가는게 몰지각 아줌마들 내쫓으면 됐지 왜 모든 아줌마를 통제하는거냐 혹시 이걸 빌미로 물관리 하는건 아닌지","clev****","1","4","","2024.06.16. 03:24","2025-06-10 02:29:34"
"16","1700","","","아줌마 없으면 헬스장 문 닫게된다.","ha55****","4","4","","2024.06.16. 02:52","2025-06-10 02:29:34"
"16","1701","","","각 지역이나 나라, 문화가 다르기도하지만 불편함도 천차만별하다.  bbc가 뭐라고 남에 나라  사회를 함부로 평하는가.  우리는 아줌마가 몰상식하다해도, 그 세대 전체가아니고 특정한 부류라고 이해한다. ㅡ 영국사회에는 불편하게 느끼는 부류가 없는가!  이런것은 우리끼리 이해할일이지, 먼나라가 굳이 끼어들일 아니다.","lhwo****","4","7","","2024.06.16. 02:38","2025-06-10 02:29:34"
"16","1702","","","아줌마들 너무 싫다","bbbb****","3","6","","2024.06.16. 01:32","2025-06-10 02:29:34"
"16","1703","","","쓰레기들 다 망해라 제발….","kkw0****","0","0","","2024.06.16. 01:28","2025-06-10 02:29:34"
"16","1704","","","뉴스만들려고 자작극인듯.문닫으려고하나?","otrr****","4","6","","2024.06.16. 00:43","2025-06-10 02:29:34"
"16","1705","","","갑자기 뜬금포로  헬스장 여성 때려잡기.돌았나?언론들","otrr****","0","1","","2024.06.16. 00:42","2025-06-10 02:29:34"
"16","1706","","","수영장에서 팬티 빨고 드라이기로 말리더라","bcin****","4","0","","2024.06.16. 00:31","2025-06-10 02:29:34"
"16","1707","","","왜 아저씨는 경멸의 뜻으로 쓰지 않고 아줌마는 그렇게 쓰이는 지 생각 좀 해봤으면..","mose****","6","2","","2024.06.16. 00:09","2025-06-10 02:29:34"
"16","1708","","","아줌마나 ㅌㄸ이 전부 진상인건 아니지만 진상들 잡고 보면 아줌마나 ㅌㄸ인 경우가 절대 다수인건 사실 아닌가","blue****","0","0","","2024.06.16. 00:00","2025-06-10 02:29:34"
"16","1709","","","한국의 여혐 아줌마 혐오 동물혐오 세상에 까발려지길","bite****","4","5","","2024.06.15. 23:57","2025-06-10 02:29:34"
"16","1710","","","아줌마들이 돈줄인데!!!! 곧 망하겟군….","hj12****","1","3","","2024.06.15. 23:45","2025-06-10 02:29:34"
"16","1711","","","아줌마 보다 매번 연간회원 가입시키고  폐업하는 이런 업종자체가 더 문제인듯","wsch****","12","2","","2024.06.15. 23:28","2025-06-10 02:29:34"
"16","1712","","","긍까 노키즈 노시니어 노아줌마가 아니라 노진상이라고 왜 그걸 모든연령대에 끼우냐고","xfil****","11","0","","2024.06.15. 22:52","2025-06-10 02:29:34"
"16","1713","","","아줌마 출입금지가 아니라 예의를 갖춰달라 정도로 해야지.  사회가 계층간 이간질을 너무 시킨다","jyhu****","33","1","","2024.06.15. 22:33","2025-06-10 02:29:34"
"16","1714","","","bbc는 한국언론이야? 한국에 관심이 많네 bbc가 아니고 정확히 bbc 한국지국아닌가? 항상 한국에 대해 많은 걸 보도하네","apmr****","0","1","","2024.06.15. 22:16","2025-06-10 02:29:34"
"16","1715","","","해외에서는 보이는 한국 사회의 이 기이한 갈라치기 사회적 문제를 한국 사람들은 문제로 인식 못하는 것이 더 큰 문제다. 노년의 평안 삶은 오직 노령층만을 위하는 것이 아닌데, 젊은층은 자신들이 무슨 큰 피해를 입고 있는 것처럼 생각하고 있다. 이런 사회적 문제를 만들어 놓고 정치적 목적으로 이용하려는 더불어 민주당의 비열한 공작 정치로 우리 사회가 더욱 윤리와 공생의 가치관을 상실하지 않도록 국민들은 의식을 가져야 한다.","axel****","4","3","","2024.06.15. 21:58","2025-06-10 02:29:34"
"16","1716","","","이유가  있겠지, 업주 입장에서 당연히 회원수 올리면 좋은데 얼마나 힘들었으면 그랬을까요? 생각해보세요.","1204****","3","4","","2024.06.15. 21:47","2025-06-10 02:29:34"
"16","1717","","","사워장에 똥싸고 오줌 갈기는데  누가 출입 시키겠냐?  공업용 미싱으로 꾸매라","song****","1","3","","2024.06.15. 21:47","2025-06-10 02:29:34"
"16","1718","","","아줌마로 퉁 친건 여성헬스장에 유독 도난사고가 많이나고 몰지각한 사람들이 주로 60대 전후반대 아줌마들이 많은거임. 남자들 중에도 60 중반 넘는 일부 멀지각한 사람들은 염색하는 사람들도 있음. 돈 안내고 들어가는 얌체족도 여자들이 훨씬 많음.","cmon****","4","2","","2024.06.15. 21:46","2025-06-10 02:29:34"
"16","1719","","","니들도 늙는다!~ㅜㅠ에효~싸기지없는것들~ㅉㅉㅉ","seed****","5","3","","2024.06.15. 21:40","2025-06-10 02:29:34"
"16","1720","","","특정 연령 그룹이 아니고 개념 쳐 말아먹은 아줌마들한테 그러는거인데...","r174****","0","0","","2024.06.15. 21:07","2025-06-10 02:29:34"
"16","1721","","","진상 아줌마들이 한짓은 아몰랑~ 거부하면 혐오야! ㅋㅋㅋ 이런 능지수준이네 ㅋㅋㅋ","love****","0","0","","2024.06.15. 20:53","2025-06-10 02:29:34"
"16","1722","","","배척은 또 다른 갈등만을 낳을 뿐. 한 개인, 개인들이 잘못한 행동을 특정 연령대를 모두 싸잡아서 같은 잣대를 들이밀면 더욱더 갈등만 심해지지 않을까... 요즘 사람들이 극도의 스트레스릍 겪고 살아서 그런지 극단적인 결론이 자꾸 나온다... 이렇게 사회가 점점 더 흉흉해지면 결국 남을 향한 그 비난의 화살 또한 본인에게 부메랑처럼 돌아올지도.","musk****","10","2","","2024.06.15. 20:39","2025-06-10 02:29:34"
"16","1723","","","뒤에 설명은 쏙 빼고 보도하냐? BBC실망이네. 저 헬스장은 개진상을 높임표현으로 아줌마라고 칭한거다. 보통 아줌마는 우아한 여성으로 부르고. 일반적인 나이대 여성들을 출입금지시킨게 아니라는거다. 정확한 내용을 보고 여섬혐오인지 판단해라","talk****","4","2","","2024.06.15. 20:28","2025-06-10 02:29:34"
"16","1724","","","아줌마들의 만행을 보면 저렇게 얘기 못하지 ... 헬스장 가서 서너 시간 요가매트 깔고 수다에 간식에, 샤워장에선 물 펑펑 틀어놓고 온갓 빨래를 하질 않나 ... 초염가에 1년치 회원권 끊어놓고 아주 업체를 파산으로 몰고가는 무개념한 존재들... 그런 이들이 실재로 존재함 ..","dhmo****","1","0","","2024.06.15. 20:26","2025-06-10 02:29:34"
"16","1725","","","헬스장 주인, 무례했다. 아줌마..후진국에서 이 만큼 올 때까지 막중한 짐 짊어 지셨던 분들. 오래전 중년여성 연구논문 서문에 지하철 타면 자리 차지하려 엉덩이 부터 들이민다고 써 웃겼지만, 그런 시절도 있었지. 따지고 보면 그땐 남자들 더 했던 것들 많았고. 지금도 마찮가지. 저런 헬스장 주인이 댓글에서 옹호 받는다면 우린 아직 후진국.","rock****","5","5","","2024.06.15. 20:22","2025-06-10 02:29:34"
"16","1726","","","젊은여자회원한테 추근대는 트레이너를 위함인가?","kyst****","4","1","","2024.06.15. 20:17","2025-06-10 02:29:34"
"16","1727","","","주인이 아둔한거지, 아줌마출입금지해놓으면 아가씨들만 오겠음? 아저씨들만 있으면 당연히 아가씨들도 분위기심란한데 하면서 그만두지, 아마 주인은 지네헬스장이 물좋은데로 소문나길바라고 그랬을수도? 근데 그게 멍청한게, 그랬다가는 아저씨들만 옴, 아저씨들 아줌마 못지않음, 지하철화장실에 빨래갖고와서 하는 할배들 거기로 모이겠지? 아저씨들 땀 쩔어있는 헬스장에 어떤아가씨들이 모이겠냐?","teo7****","7","4","","2024.06.15. 20:03","2025-06-10 02:29:34"
"16","1728","","","나라가 젖같으니깐~~   헬스장 2찍이가 아주 지럴을하네ㆍ","jwys****","0","0","","2024.06.15. 19:58","2025-06-10 02:29:34"
"16","1729","","","한국은 말야. 나이, 학벌, 종교. 지역, 성별, 세대, 직업, 재산, 정치 이념, 장애여부 등에 타라 천차만별의 집단들이 있어. 한국에서 육체적으로나 정신적으로 맑게 사는건 바로 자연인이 되는것 뿐이야.","samp****","5","1","","2024.06.15. 19:47","2025-06-10 02:29:34"
"16","1730","","","나이 안쓰고 인성 썼는데. 뭔 연령..","harr****","1","3","","2024.06.15. 19:46","2025-06-10 02:29:34"
"16","1731","","","헬조선, 나라 망조다!!","kg20****","3","0","","2024.06.15. 19:43","2025-06-10 02:29:34"
"16","1732","","","K- 아줌마들!! BBC 까지 상륙 했구나!","noma****","0","0","","2024.06.15. 19:42","2025-06-10 02:29:34"
"16","1733","","","근데 외국도 아저씨 아줌마들 한국하고 비슷함??그냥 이건 인류의 문제인가 하고 생각.난 일단 저 부류하고 안 엮일려는 이유가 소통이 전혀 안돼.상대말은 아예 듣질 않더라구.나도 아저씨이지만 친구들하고 어디 안다녀 챙피해서.","tx74****","0","1","","2024.06.15. 19:39","2025-06-10 02:29:34"
"16","1734","","","그 헬스장 아직도 영업중?","smen****","2","0","","2024.06.15. 19:37","2025-06-10 02:29:34"
"16","1735","","","무대뽀라서","jys8****","2","1","","2024.06.15. 19:32","2025-06-10 02:29:34"
"16","1736","","","나도 아줌마이지만  몰상식의 대명사가 아줌마인건 사실!!!!.....    하지만 늙은 꼰대.   개저씨,   무개념 20대 30대.....따라서 모든 연령에서 비정상이  존재합니다.....내생각","diva****","9","2","","2024.06.15. 19:31","2025-06-10 02:29:34"
"16","1737","","","일부 부도덕한 무개념이  얼마나 심했는지 알진못하지만 실은 나이든 아줌마말고도 무개념 여자들은 어릴때도  도덕성없고 개념없습니다. 심지어 남의것을 훔치고 박살내면서도 부끄러운지도모르고 당당하게 평생 민폐부리고 사는거지 나이든아줌마들만 그러는건아니죠.","ming****","7","1","","2024.06.15. 19:27","2025-06-10 02:29:34"
"16","1738","","","업주자체가 마인드가 양아치 그 자체","mira****","6","3","","2024.06.15. 19:20","2025-06-10 02:29:34"
"16","1739","","","땡열이처럼 갈라치기 국대네ㅎ","aa2s****","1","1","","2024.06.15. 19:18","2025-06-10 02:29:34"
"16","1740","","","한국사정도 잘 모르는 BBC같은 외신이 왈가왈부할 사안이 아님 즉 모르면 닥쳐야지","jhit****","0","0","","2024.06.15. 19:14","2025-06-10 02:29:34"
"16","1741","","","흑인차별하고 백인쏴죽이는 나라 ㅋㅋ","sim9****","1","0","","2024.06.15. 19:14","2025-06-10 02:29:34"
"16","1742","","","어처구니가 없다","msoo****","2","0","","2024.06.15. 19:09","2025-06-10 02:29:34"
"16","1743","","","니네들도 목욕탕이나 헬스장에서 수건 좀 도둑맞아 보면 금세 아줌마 출입금지 붙일 거 다 안다","amer****","3","0","","2024.06.15. 19:07","2025-06-10 02:29:34"
"16","1744","","","피해주는 아줌마를 지칭하잖아 ᆢ당신도 사장일때 그런 피해주는 아줌마한테 관대할수 있을까?  망할려고 영업장여는 사람은 아무도없다 ᆢ","kkyy****","1","1","","2024.06.15. 19:06","2025-06-10 02:29:34"
"16","1745","","","얘네는 할일이없나 코딱지만한  외국소식은 왜 퍼다나르나","bow_****","1","0","","2024.06.15. 19:06","2025-06-10 02:29:34"
"16","1746","","","그 헬스장 가는 젊은이들 거의 아줌마들이 용돈 줘서 가는 것 알기나 하냐... 이 모지리 사람아......","kang****","6","1","","2024.06.15. 19:01","2025-06-10 02:29:34"
"16","1747","","","망해봐라  식은밥 따뜻한 밥가려지나??.","ryu2****","3","0","","2024.06.15. 18:58","2025-06-10 02:29:34"
"16","1748","","","결혼하면  모두가  아줌니 아닌가?  그리고 아줌 마면 어때..다음은 할머니인데","sky1****","0","0","","2024.06.15. 18:51","2025-06-10 02:29:34"
"16","1749","","","BBC가 뭐라고 대한민국을 흔들려고 하나. 이런식으로 편파 취재를 할거면 왜 노키즈존이 생겼는지 뭐가 문제인지부터 취재해서 방영해라. 이게 한국에서만 문제다라고만 던져놓고 아님말고 하지말고","dlgo****","2","3","","2024.06.15. 18:50","2025-06-10 02:29:34"
"16","1750","","","그들이 몰려온다 쿵캉쿵캉","soul****","2","0","","2024.06.15. 18:47","2025-06-10 02:29:34"
"16","1751","","","그런데 나도 아줌만데 gx다니는 여인들 정말 심각하게 시끄럽긴하다요 오전시간에 탈의실 아주 혼이 빠진다 락카 자리 맡아주기 드라이기 물려주기 남들 운동하는데 여기저기 와글와글 몰려앉아 수다떨기 진짜 징하긴하다 왜 이런식으로 아줌마로 뭉뚱그려 특정지어지는건데 일단 너무 시끄럽다 헬스장에서 아저씨들이 저러는거 봤응?","bobz****","4","0","","2024.06.15. 18:45","2025-06-10 02:29:34"
"16","1752","","","배부러서 밬으로 튀어나온듯","lbh2****","0","0","","2024.06.15. 18:44","2025-06-10 02:29:34"
"16","1753","","","BBC  지들이 뭔데 평가질.이야~???  니들이 한국의 김여사아줌마들을 알아~~??  나도 아줌마지만 아줌마들의 잘못된 행태에 대해 지적하는건데. 고칠건 고쳐야지. ~~ ! 그리고 노키즈존하는 심정을 니들이 알아~~??  맘충이란 용어가 왜 생겼는지 아냐고~???  작은나라 한국이라고 니들 잣대로 떠들어대지마라 !!. 말로해서 안되니까 .!!!!  그렇게 하는거지..!!!! 지들은 사회적 문제점이 없는것처럼 다른나라 일에 참견질이야. 승질나게~~~~","didt****","0","0","","2024.06.15. 18:43","2025-06-10 02:29:34"
"16","1754","","","아줌마기준 30대~60대. 70부터할머니","nada****","2","0","","2024.06.15. 18:42","2025-06-10 02:29:34"
"16","1755","","","‘아줌마’는 보통 30대 후반 이후의 나이 든 여성을 가리키는 용어인데 특정 피해의식은 가진 집단이 긁혀서 갈작하는 용어죠","d41t****","2","1","","2024.06.15. 18:42","2025-06-10 02:29:34"
"16","1756","","","장사꾼 맘이지만 저런 심보로 장사하면 복이 다 달아나고 손님도 끊길거다 에휴","nekk****","3","1","","2024.06.15. 18:41","2025-06-10 02:29:34"
"16","1757","","","똘레랑스","hno2****","0","0","","2024.06.15. 18:40","2025-06-10 02:29:34"
"16","1758","","","저런거 붙이전 전에 각종 비난이 있을 것을 생각해 봤을텐데, 오죽 했으면 저런 것 까지 붙였을까 싶기도 하네.","stro****","2","0","","2024.06.15. 18:39","2025-06-10 02:29:34"
"16","1759","","","헬스와서 운동만 하면 된다 자꾸 말을 하기 시작하면 문제가 생긴다","naey****","1","0","","2024.06.15. 18:31","2025-06-10 02:29:34"
"16","1760","","","격어보면  안다  아줌마  오죽하면","chul****","2","0","","2024.06.15. 18:29","2025-06-10 02:29:34"
"16","1761","","","그나저나 유튜브에서는 헬스장에서 레깅스 입은 여자 방뎅이를 왜 자꾸 보여주는지 몰겠더만. 조회수 목적인감..","rusu****","2","1","","2024.06.15. 18:26","2025-06-10 02:29:34"
"16","1762","","","전에 헬스 다닐 때  샤워장에 물 아껴  쓰라는 문구  있었는데도  뜨거운 물 틀어 놓고 그 밑에서 도를 닦는지 오래 앉아 있던  여자는 있었는데   ㅋㅋ","clev****","0","0","","2024.06.15. 18:25","2025-06-10 02:29:34"
"16","1763","","","어떤 대한민국 아줌마는 조금 모자란 중국인이라고 보면 된다고 BBC에 알려줘라.","djid****","2","5","","2024.06.15. 18:23","2025-06-10 02:29:34"
"16","1764","","","전세계적으로 한국아줌마 개망신, 나이 드신 분들 이제 좀 변합시다. 여기저기 다니며 피해주지 말고...","yola****","2","2","","2024.06.15. 18:23","2025-06-10 02:29:34"
"16","1765","","","차별금지법 아직도 안 만들었냐? 국개들 노네 놀아","rmfl****","0","0","","2024.06.15. 18:21","2025-06-10 02:29:34"
